question,expected_answer,category
What are the benefits of microservices?,"Microservices provide scalability, independent deployment, faster releases and better maintainability.",microservices
What is Sustainable IT?,"Sustainable IT focuses on reducing carbon and resource impact through optimization and smart data.",sustainability
What sustainability initiatives are mentioned?,"GlobalLogic focuses on decarbonization, resource efficiency, circular economy, connected mobility, green technology, Responsible Design and Sustainable IT.",sustainability
How does GlobalLogic help healthcare organizations improve patient experience?,"GlobalLogic builds digital healthcare platforms, connected health systems and patient therapy solutions to improve engagement and outcomes.",healthcare
What cloud modernization services does GlobalLogic offer?,"GlobalLogic offers cloud enablement, SaaSification, modernization and cloud-native transformation services.",cloud